{
  "$schema": "https://json-schema.org/draft/2020-12/schema",
  "type": "object",
  "properties": {
    "seq": {
      "type": "integer",
      "minimum": 0,
      "maximum": 9007199254740991
    },
    "id": {
      "type": "string",
      "format": "uuid",
      "pattern": "^([0-9a-fA-F]{8}-[0-9a-fA-F]{4}-[1-8][0-9a-fA-F]{3}-[89abAB][0-9a-fA-F]{3}-[0-9a-fA-F]{12}|00000000-0000-0000-0000-000000000000|ffffffff-ffff-ffff-ffff-ffffffffffff)$"
    },
    "requestId": {
      "anyOf": [
        {
          "type": "string"
        },
        {
          "type": "null"
        }
      ]
    },
    "sessionId": {
      "type": "string",
      "format": "uuid",
      "pattern": "^([0-9a-fA-F]{8}-[0-9a-fA-F]{4}-[1-8][0-9a-fA-F]{3}-[89abAB][0-9a-fA-F]{3}-[0-9a-fA-F]{12}|00000000-0000-0000-0000-000000000000|ffffffff-ffff-ffff-ffff-ffffffffffff)$"
    },
    "tier": {
      "anyOf": [
        {
          "type": "string",
          "enum": [
            "OLLAMA_LOCAL",
            "API_EXTERNAL"
          ]
        },
        {
          "type": "null"
        }
      ]
    },
    "type": {
      "type": "string",
      "enum": [
        "SYSTEM",
        "CONNECTED",
        "USER_PROMPT",
        "ROUTING",
        "TIER_SELECTED",
        "TOOL_CALL",
        "RESULT",
        "PENDING_APPROVAL",
        "ERROR"
      ]
    },
    "message": {
      "type": "string"
    },
    "metadata": {},
    "timestamp": {
      "type": "string",
      "format": "date-time",
      "pattern": "^(?:(?:\\d\\d[2468][048]|\\d\\d[13579][26]|\\d\\d0[48]|[02468][048]00|[13579][26]00)-02-29|\\d{4}-(?:(?:0[13578]|1[02])-(?:0[1-9]|[12]\\d|3[01])|(?:0[469]|11)-(?:0[1-9]|[12]\\d|30)|(?:02)-(?:0[1-9]|1\\d|2[0-8])))T(?:(?:[01]\\d|2[0-3]):[0-5]\\d(?::[0-5]\\d(?:\\.\\d+)?)?(?:Z))$"
    }
  },
  "required": [
    "id",
    "requestId",
    "sessionId",
    "tier",
    "type",
    "message",
    "timestamp"
  ],
  "additionalProperties": false
}